<?xml version="1.0" encoding="UTF-8"?>
<busi:Template xmlns:busi="http://www.iot.cn/BusiTemplate"
	xmlns:xsi="http://www.w3.org/2001/XMLSchema-instance"
	xsi:schemaLocation="http://www.iot.cn/BusiTemplate BusiTemplate.xsd ">

	<!-- 业务操作流程  D.1. 上行桥连接建立流程-->
	<OperationFlow operationReturn="InternetGatewayDevice.X_CMCC_UserInfo.Result">
		<FlowBean id="PPPoE_Bridged">
			
			<!-- <FlowBeanAdd id="WANDevice">
				<Command>InternetGatewayDevice.WANDevice.</Command>
			</FlowBeanAdd>
			
			<FlowBeanAdd id="WANConnectionDevice" ref="WANDevice">
				<Command>WANConnectionDevice.</Command>
			</FlowBeanAdd>
			
			2.添加实例
			<FlowBeanAdd id="WANPPPConnection" ref="WANConnectionDevice">
				<Command>WANPPPConnection.</Command>
			</FlowBeanAdd> -->
			
			<!-- 1.添加实例 -->
			<FlowBeanAdd id="WANConnectionDevice">
				<Command>InternetGatewayDevice.WANDevice.1.WANConnectionDevice.</Command>
			</FlowBeanAdd>
			<!-- 2.添加实例 -->
			<FlowBeanAdd id="WANPPPConnection" ref="WANConnectionDevice">
				<Command>WANPPPConnection.</Command>
			</FlowBeanAdd>
			
			<!-- 3.设置参数 -->
			<FlowBeanSet ref="WANPPPConnection">
				<SetParam>
					<Command>X_CMCC_VLANMode</Command>
					<ParamKey>X_CMCC_VLANMode</ParamKey>
				</SetParam>
				<SetParam>
					<Command>X_CMCC_VLANIDMark</Command>
					<ParamKey>X_CMCC_VLANIDMark</ParamKey>
				</SetParam>
				<SetParam>
					<Command>ConnectionType</Command>
					<Default>PPPoE_Bridged</Default>
				</SetParam>
				<SetParam>
					<Command>X_CMCC_LanInterface</Command>
					<ParamKey>X_CMCC_LanInterface</ParamKey>
				</SetParam>
				<SetParam>
					<Command>X_CMCC_ServiceList</Command>
					<ParamKey>X_CMCC_ServiceList</ParamKey>
				</SetParam>
				<SetParam>
					<Command>Enable</Command>
					<Default>1</Default>
				</SetParam>
			</FlowBeanSet>
		</FlowBean>
	</OperationFlow>
</busi:Template>